{
  "$schema": "https://json-schema.org/draft/2020-12/schema",
  "$id": "https://jungial.local/schemas/weather_trace.schema.json",
  "title": "WeatherTraceV1",
  "type": "object",
  "required": [
    "schema",
    "schemaVersion",
    "traceId",
    "weatherId",
    "mood",
    "pressure",
    "sourceTags",
    "resultingTags",
    "suppressedTags",
    "strongestDreadAxis"
  ],
  "properties": {
    "schema": { "const": "WeatherTraceV1" },
    "schemaVersion": { "const": 1 },
    "traceId": { "type": "string", "minLength": 1 },
    "weatherId": { "type": ["string", "null"] },
    "mood": { "enum": ["stillness", "hush", "gravity", "flicker", "bloom", "eclipse"] },
    "pressure": { "enum": ["low", "medium", "heavy", "storm"] },
    "sourceTags": { "type": "array", "items": { "$ref": "#/$defs/weatherTag" } },
    "resultingTags": { "type": "array", "items": { "$ref": "#/$defs/weatherTag" } },
    "suppressedTags": { "type": "array", "items": { "$ref": "#/$defs/weatherTag" } },
    "strongestDreadAxis": {
      "enum": [
        "pursuit",
        "bodyUnease",
        "cosmicDread",
        "disorientation",
        "loss",
        "watching",
        "claustrophobia"
      ]
    }
  },
  "additionalProperties": false,
  "$defs": {
    "weatherTag": {
      "enum": [
        "silence",
        "threshold",
        "soft_lamp",
        "mirror",
        "ash",
        "mist",
        "static",
        "gravity",
        "garden",
        "warmth",
        "cold",
        "distant_voice",
        "watching",
        "boundless",
        "contained",
        "pursuit",
        "bodyUnease",
        "cosmicDread",
        "disorientation",
        "loss",
        "claustrophobia",
        "annihilation",
        "rebirth",
        "cosmic_mystery",
        "reflection",
        "shadow",
        "self_observation",
        "safety",
        "memory",
        "hearth",
        "containment",
        "growth",
        "innocence",
        "fertility",
        "beauty",
        "dissolution",
        "void",
        "star",
        "unknown",
        "invitation",
        "door",
        "breath",
        "lamp"
      ]
    }
  }
}
