{
  "schema": "WeatherTraceV1",
  "schemaVersion": 1,
  "traceId": "weather-trace-777",
  "weatherId": "weather-777",
  "mood": "stillness",
  "pressure": "medium",
  "sourceTags": [
    "dissolution",
    "silence",
    "threshold",
    "memory"
  ],
  "resultingTags": [
    "silence",
    "threshold",
    "dissolution",
    "memory"
  ],
  "suppressedTags": [],
  "strongestDreadAxis": "cosmicDread"
}
